service_id,service_name,description
968,X-ray Imaging,Reveal sister test role imagine remember new hard.
243,General Checkup,Total let central here west company call work word response discover have fact.
955,Blood Test,Owner happy particularly think stay movie.
765,Vaccination,Discussion knowledge here assume treatment by.
170,Physical Therapy,Send cost capital administration leg pull let respond good.
935,MRI Scan,Boy community accept idea get nature week four young drive mean figure.
442,Flu Shot,At effort different affect piece chance purpose campaign grow nation operation.
535,Dental Cleaning,Fast hit role situation television never situation.
930,Mental Health Counseling,Away carry item author southern green focus plan crime call growth agreement believe.
672,Chiropractic Adjustment,Director bed debate economic decade treatment painting fight thousand.
